{"expectations":[{"fixture_id":"RVR-RSI-001","prediction":{"RVR-RSI-001/no_amendment":{"local_validity":true,"observation":{"outputs":{"claim_admissible":false,"crypto_authentication":{"reason":"no_pinned_signature_verification_lane","status":"UNSUPPORTED"},"requested_claim":"digest_binding","substantive_resolution":"not_evaluated","transition":{"amendment_cc":null,"effective_profile_commitment":"cc458bd42359a4dcd873cd3bde38cc45e5562f51f674c214b4659030317c70ce","new_profile_commitment":"cc458bd42359a4dcd873cd3bde38cc45e5562f51f674c214b4659030317c70ce","prior_profile_commitment":"cc458bd42359a4dcd873cd3bde38cc45e5562f51f674c214b4659030317c70ce","transition_status":"unresolved"},"verdict_binding":null},"relation_id":"profile-and-verdict-digest-binding","relation_state":"digest_binding_observed"}},"RVR-RSI-001/retained_profile_bound_verdict":{"local_validity":true,"observation":{"outputs":{"claim_admissible":false,"crypto_authentication":{"reason":"no_pinned_signature_verification_lane","status":"UNSUPPORTED"},"requested_claim":"digest_binding","substantive_resolution":"not_evaluated","transition":{"amendment_cc":null,"effective_profile_commitment":"cc458bd42359a4dcd873cd3bde38cc45e5562f51f674c214b4659030317c70ce","new_profile_commitment":"cc458bd42359a4dcd873cd3bde38cc45e5562f51f674c214b4659030317c70ce","prior_profile_commitment":"cc458bd42359a4dcd873cd3bde38cc45e5562f51f674c214b4659030317c70ce","transition_status":"unresolved"},"verdict_binding":{"bound_profile_commitment":"cc458bd42359a4dcd873cd3bde38cc45e5562f51f674c214b4659030317c70ce","resolution_status":"bound","verdict_core_cc":"7464a2611f474e7104ec7d501eeaec99de97b25ef9e5f202485bbef356c583b0"}},"relation_id":"profile-and-verdict-digest-binding","relation_state":"digest_binding_observed"}}}},{"fixture_id":"RVR-RSI-002","prediction":{"RVR-RSI-002/unbound_substitution":{"local_validity":true,"observation":{"outputs":{"claim_admissible":false,"crypto_authentication":{"reason":"no_pinned_signature_verification_lane","status":"UNSUPPORTED"},"requested_claim":"digest_binding","substantive_resolution":"not_evaluated","transition":{"amendment_cc":null,"effective_profile_commitment":"cc458bd42359a4dcd873cd3bde38cc45e5562f51f674c214b4659030317c70ce","new_profile_commitment":"c5561c0ddd64f3b971563ef2ec08b812b2aaad3787ed8de3cc39d69d9fd35984","prior_profile_commitment":"cc458bd42359a4dcd873cd3bde38cc45e5562f51f674c214b4659030317c70ce","transition_status":"unresolved"},"verdict_binding":null},"relation_id":"profile-and-verdict-digest-binding","relation_state":"digest_binding_observed"}},"RVR-RSI-002/wrong_party_digest":{"local_validity":true,"observation":{"outputs":{"claim_admissible":false,"crypto_authentication":{"reason":"no_pinned_signature_verification_lane","status":"UNSUPPORTED"},"requested_claim":"digest_binding","substantive_resolution":"not_evaluated","transition":{"amendment_cc":"6e1e3f6df4a77a9e38b0eaaf64f5d5eb3297acf4dbdc9e0c80e14c1ce93324e5","effective_profile_commitment":"cc458bd42359a4dcd873cd3bde38cc45e5562f51f674c214b4659030317c70ce","new_profile_commitment":"c5561c0ddd64f3b971563ef2ec08b812b2aaad3787ed8de3cc39d69d9fd35984","prior_profile_commitment":"cc458bd42359a4dcd873cd3bde38cc45e5562f51f674c214b4659030317c70ce","transition_status":"unresolved"},"verdict_binding":null},"relation_id":"profile-and-verdict-digest-binding","relation_state":"digest_binding_observed"}}}},{"fixture_id":"RVR-RSI-003","prediction":{"RVR-RSI-003/bilateral_binding":{"local_validity":true,"observation":{"outputs":{"claim_admissible":true,"crypto_authentication":{"reason":"no_pinned_signature_verification_lane","status":"UNSUPPORTED"},"requested_claim":"digest_binding","substantive_resolution":"not_evaluated","transition":{"amendment_cc":"6e1e3f6df4a77a9e38b0eaaf64f5d5eb3297acf4dbdc9e0c80e14c1ce93324e5","effective_profile_commitment":"c5561c0ddd64f3b971563ef2ec08b812b2aaad3787ed8de3cc39d69d9fd35984","new_profile_commitment":"c5561c0ddd64f3b971563ef2ec08b812b2aaad3787ed8de3cc39d69d9fd35984","prior_profile_commitment":"cc458bd42359a4dcd873cd3bde38cc45e5562f51f674c214b4659030317c70ce","transition_status":"permitted"},"verdict_binding":null},"relation_id":"profile-and-verdict-digest-binding","relation_state":"digest_binding_observed"}},"RVR-RSI-003/pubkey_representation_change":{"local_validity":true,"observation":{"outputs":{"claim_admissible":true,"crypto_authentication":{"reason":"no_pinned_signature_verification_lane","status":"UNSUPPORTED"},"requested_claim":"digest_binding","substantive_resolution":"not_evaluated","transition":{"amendment_cc":"6e1e3f6df4a77a9e38b0eaaf64f5d5eb3297acf4dbdc9e0c80e14c1ce93324e5","effective_profile_commitment":"c5561c0ddd64f3b971563ef2ec08b812b2aaad3787ed8de3cc39d69d9fd35984","new_profile_commitment":"c5561c0ddd64f3b971563ef2ec08b812b2aaad3787ed8de3cc39d69d9fd35984","prior_profile_commitment":"cc458bd42359a4dcd873cd3bde38cc45e5562f51f674c214b4659030317c70ce","transition_status":"permitted"},"verdict_binding":null},"relation_id":"profile-and-verdict-digest-binding","relation_state":"digest_binding_observed"}}}},{"fixture_id":"RVR-RSI-004","prediction":{"RVR-RSI-004/correct_verdict":{"local_validity":true,"observation":{"outputs":{"claim_admissible":true,"crypto_authentication":{"reason":"no_pinned_signature_verification_lane","status":"UNSUPPORTED"},"requested_claim":"digest_binding","substantive_resolution":"not_evaluated","transition":{"amendment_cc":"6e1e3f6df4a77a9e38b0eaaf64f5d5eb3297acf4dbdc9e0c80e14c1ce93324e5","effective_profile_commitment":"c5561c0ddd64f3b971563ef2ec08b812b2aaad3787ed8de3cc39d69d9fd35984","new_profile_commitment":"c5561c0ddd64f3b971563ef2ec08b812b2aaad3787ed8de3cc39d69d9fd35984","prior_profile_commitment":"cc458bd42359a4dcd873cd3bde38cc45e5562f51f674c214b4659030317c70ce","transition_status":"permitted"},"verdict_binding":{"bound_profile_commitment":"c5561c0ddd64f3b971563ef2ec08b812b2aaad3787ed8de3cc39d69d9fd35984","resolution_status":"bound","verdict_core_cc":"4737bd0ea50300752149ab2d50f58c90f7089ee56ebbe7a4861e243082319986"}},"relation_id":"profile-and-verdict-digest-binding","relation_state":"digest_binding_observed"}},"RVR-RSI-004/different_verdict_same_binding":{"local_validity":true,"observation":{"outputs":{"claim_admissible":true,"crypto_authentication":{"reason":"no_pinned_signature_verification_lane","status":"UNSUPPORTED"},"requested_claim":"digest_binding","substantive_resolution":"not_evaluated","transition":{"amendment_cc":"6e1e3f6df4a77a9e38b0eaaf64f5d5eb3297acf4dbdc9e0c80e14c1ce93324e5","effective_profile_commitment":"c5561c0ddd64f3b971563ef2ec08b812b2aaad3787ed8de3cc39d69d9fd35984","new_profile_commitment":"c5561c0ddd64f3b971563ef2ec08b812b2aaad3787ed8de3cc39d69d9fd35984","prior_profile_commitment":"cc458bd42359a4dcd873cd3bde38cc45e5562f51f674c214b4659030317c70ce","transition_status":"permitted"},"verdict_binding":{"bound_profile_commitment":"c5561c0ddd64f3b971563ef2ec08b812b2aaad3787ed8de3cc39d69d9fd35984","resolution_status":"bound","verdict_core_cc":"5bb05a5a7ba5177a04cc9f07642dec3fee3b2b48ea0eefe88939afcc42d67360"}},"relation_id":"profile-and-verdict-digest-binding","relation_state":"digest_binding_observed"}}}},{"fixture_id":"RVR-RSI-005","prediction":{"RVR-RSI-005/stale_profile_locally_digest_bound":{"local_validity":true,"observation":{"outputs":{"claim_admissible":false,"crypto_authentication":{"reason":"no_pinned_signature_verification_lane","status":"UNSUPPORTED"},"requested_claim":"digest_binding","substantive_resolution":"not_evaluated","transition":{"amendment_cc":"6e1e3f6df4a77a9e38b0eaaf64f5d5eb3297acf4dbdc9e0c80e14c1ce93324e5","effective_profile_commitment":"c5561c0ddd64f3b971563ef2ec08b812b2aaad3787ed8de3cc39d69d9fd35984","new_profile_commitment":"c5561c0ddd64f3b971563ef2ec08b812b2aaad3787ed8de3cc39d69d9fd35984","prior_profile_commitment":"cc458bd42359a4dcd873cd3bde38cc45e5562f51f674c214b4659030317c70ce","transition_status":"permitted"},"verdict_binding":{"bound_profile_commitment":null,"resolution_status":"unresolved","verdict_core_cc":"7464a2611f474e7104ec7d501eeaec99de97b25ef9e5f202485bbef356c583b0"}},"relation_id":"profile-and-verdict-digest-binding","relation_state":"digest_binding_observed"}}}},{"fixture_id":"RVR-RSI-006","prediction":{"RVR-RSI-006/no_crypto_promotion":{"local_validity":true,"observation":{"outputs":{"claim_admissible":false,"crypto_authentication":{"reason":"no_pinned_signature_verification_lane","status":"UNSUPPORTED"},"requested_claim":"crypto_authentication","substantive_resolution":"not_evaluated","transition":{"amendment_cc":"6e1e3f6df4a77a9e38b0eaaf64f5d5eb3297acf4dbdc9e0c80e14c1ce93324e5","effective_profile_commitment":"c5561c0ddd64f3b971563ef2ec08b812b2aaad3787ed8de3cc39d69d9fd35984","new_profile_commitment":"c5561c0ddd64f3b971563ef2ec08b812b2aaad3787ed8de3cc39d69d9fd35984","prior_profile_commitment":"cc458bd42359a4dcd873cd3bde38cc45e5562f51f674c214b4659030317c70ce","transition_status":"permitted"},"verdict_binding":{"bound_profile_commitment":"c5561c0ddd64f3b971563ef2ec08b812b2aaad3787ed8de3cc39d69d9fd35984","resolution_status":"bound","verdict_core_cc":"4737bd0ea50300752149ab2d50f58c90f7089ee56ebbe7a4861e243082319986"}},"relation_id":"profile-and-verdict-digest-binding","relation_state":"digest_binding_observed"}}}}],"fixture_set_digest":"a6ff951d677f8e2c79f38eb966e056d888345fd297fcbe1b07bc90b131ed9a01","profile_id":"rvr.digest-binding.v0","profile_version":"0","schema":"rsi-expectations.v0"}
