{"expectations":[{"fixture_id":"TAS-RSI-001","prediction":{"TAS-RSI-001/control":{"local_validity":true,"observation":{"outputs":{"context_authenticity":"SUPPLIED_NOT_RECOMPUTED","execution_occurrence":"UNSUPPORTED","invocation_admitted":true,"native":{"dispatched":{"arguments":["0x1111111111111111111111111111111111111111111111111111111111111111"],"chainId":"31337","contractAddress":"0x1000000000000000000000000000000000000001","rpcUrl":"http://127.0.0.1:8545","target":"AgentWorkflowClient.getTask","wallet":"0x2000000000000000000000000000000000000002"},"error":"EXTERNAL_UNAVAILABLE"}},"relation_id":"verified-workflow-dispatch","relation_state":"conditional_dispatch_observed"}},"TAS-RSI-001/not_accepted":{"local_validity":true,"observation":{"outputs":{"context_authenticity":"SUPPLIED_NOT_RECOMPUTED","execution_occurrence":"UNSUPPORTED","invocation_admitted":false,"native":{"dispatched":null,"error":"WORKFLOW_SOURCE_VERIFICATION_REQUIRED"}},"relation_id":"verified-workflow-dispatch","relation_state":"conditional_dispatch_observed"}}}},{"fixture_id":"TAS-RSI-002","prediction":{"TAS-RSI-002/workflow_substitution":{"local_validity":true,"observation":{"outputs":{"context_authenticity":"SUPPLIED_NOT_RECOMPUTED","execution_occurrence":"UNSUPPORTED","invocation_admitted":false,"native":{"dispatched":null,"error":"WORKFLOW_SOURCE_VERIFICATION_REQUIRED"}},"relation_id":"verified-workflow-dispatch","relation_state":"conditional_dispatch_observed"}}}},{"fixture_id":"TAS-RSI-004","prediction":{"TAS-RSI-004/fingerprint_substitution":{"local_validity":true,"observation":{"outputs":{"context_authenticity":"SUPPLIED_NOT_RECOMPUTED","execution_occurrence":"UNSUPPORTED","invocation_admitted":false,"native":{"dispatched":null,"error":"WORKFLOW_SOURCE_VERIFICATION_REQUIRED"}},"relation_id":"verified-workflow-dispatch","relation_state":"conditional_dispatch_observed"}},"TAS-RSI-004/member_stale_block":{"local_validity":true,"observation":{"outputs":{"context_authenticity":"SUPPLIED_NOT_RECOMPUTED","execution_occurrence":"UNSUPPORTED","invocation_admitted":false,"native":{"dispatched":null,"error":"AUTHORIZATION_DENIED"}},"relation_id":"verified-workflow-dispatch","relation_state":"conditional_dispatch_observed"}},"TAS-RSI-004/member_substitution":{"local_validity":true,"observation":{"outputs":{"context_authenticity":"SUPPLIED_NOT_RECOMPUTED","execution_occurrence":"UNSUPPORTED","invocation_admitted":false,"native":{"dispatched":null,"error":"AUTHORIZATION_DENIED"}},"relation_id":"verified-workflow-dispatch","relation_state":"conditional_dispatch_observed"}}}},{"fixture_id":"TAS-RSI-005","prediction":{"TAS-RSI-005/new_exact_block":{"local_validity":true,"observation":{"outputs":{"context_authenticity":"SUPPLIED_NOT_RECOMPUTED","execution_occurrence":"UNSUPPORTED","invocation_admitted":true,"native":{"dispatched":{"arguments":["0x1111111111111111111111111111111111111111111111111111111111111111"],"chainId":"31337","contractAddress":"0x1000000000000000000000000000000000000001","rpcUrl":"http://127.0.0.1:8545","target":"AgentWorkflowClient.getTask","wallet":"0x2000000000000000000000000000000000000002"},"error":"EXTERNAL_UNAVAILABLE"}},"relation_id":"verified-workflow-dispatch","relation_state":"conditional_dispatch_observed"}}}},{"fixture_id":"TAS-RSI-006","prediction":{"TAS-RSI-006/dispatch_is_not_execution":{"local_validity":true,"observation":{"outputs":{"context_authenticity":"SUPPLIED_NOT_RECOMPUTED","execution_occurrence":"UNSUPPORTED","invocation_admitted":true,"native":{"dispatched":{"arguments":["0x1111111111111111111111111111111111111111111111111111111111111111"],"chainId":"31337","contractAddress":"0x1000000000000000000000000000000000000001","rpcUrl":"http://127.0.0.1:8545","target":"AgentWorkflowClient.getTask","wallet":"0x2000000000000000000000000000000000000002"},"error":"EXTERNAL_UNAVAILABLE"}},"relation_id":"verified-workflow-dispatch","relation_state":"conditional_dispatch_observed"}}}}],"fixture_set_digest":"d5386bbe2367747d32902b38828b746b7f737091efb8897e01cf118163b06e22","profile_id":"tas.context-invocation.v0","profile_version":"0","schema":"rsi-expectations.v0"}
