{"expectations":[{"fixture_id":"PQ-RSI-001","prediction":{"PQ-RSI-001/before_cutoff":{"local_validity":true,"observation":{"outputs":{"algorithm_identity":{"algorithm_specific_verification":"UNSUPPORTED","artifact_algorithm":"SLH-DSA-SHA2-192s","label_matches_artifact":false,"reported_label":"ML-DSA"},"anchor_validation":{"reason":"anchor_evidence_is_supplied_policy_input_not_recomputed_here","status":"UNSUPPORTED"},"authenticated_transition_validation":{"reason":"offline_source_defers_signature_verification","status":"UNSUPPORTED"},"claim_admissible":true,"current_binding":{"name":"kya-l4-genesis","pq_pubkey":"638c79a2210c85e8cb349fc72a6583b7ff82e003ff02117f8f7f9d8cc3fb92a33e7496d987beb05f22bf12ecf34bc7aa","reason":"resolved_at_anchor_time"},"historical_eligibility":true,"history_matches_pin":true,"policy":{"decision":"ADMIT","resolution_reason":"resolved_at_anchor_time","resolved":"kya-l4-genesis","resolved_pq_pubkey":"638c79a2210c85e8cb349fc72a6583b7ff82e003ff02117f8f7f9d8cc3fb92a33e7496d987beb05f22bf12ecf34bc7aa","rule":"anchored_before_cutoff"},"requested_claim":"policy_eligibility","snapshot_matches":true,"transition_metadata":{"predecessor_present":true,"signature_fields_present":true}},"relation_id":"policy-cutoff-asof","relation_state":"conditional_policy_observed"}}}},{"fixture_id":"PQ-RSI-002","prediction":{"PQ-RSI-002/retired_key":{"local_validity":true,"observation":{"outputs":{"algorithm_identity":{"algorithm_specific_verification":"UNSUPPORTED","artifact_algorithm":"SLH-DSA-SHA2-192s","label_matches_artifact":false,"reported_label":"ML-DSA"},"anchor_validation":{"reason":"anchor_evidence_is_supplied_policy_input_not_recomputed_here","status":"UNSUPPORTED"},"authenticated_transition_validation":{"reason":"offline_source_defers_signature_verification","status":"UNSUPPORTED"},"claim_admissible":false,"current_binding":{"name":"kya-l4-rotation-1","pq_pubkey":"8488157a2b55ba45f7dd6768db29bc9013936ea668a3001ca33cc817328c373c714d84d3872f1bb619bec02268ab34b5","reason":"resolved_at_anchor_time"},"historical_eligibility":false,"history_matches_pin":true,"policy":{"decision":"REJECT","resolution_reason":"resolved_at_anchor_time","resolved":"kya-l4-rotation-1","resolved_pq_pubkey":"8488157a2b55ba45f7dd6768db29bc9013936ea668a3001ca33cc817328c373c714d84d3872f1bb619bec02268ab34b5","rule":"post_cutoff_no_valid_companion"},"requested_claim":"policy_eligibility","snapshot_matches":true,"transition_metadata":{"predecessor_present":true,"signature_fields_present":true}},"relation_id":"policy-cutoff-asof","relation_state":"conditional_policy_observed"}}}},{"fixture_id":"PQ-RSI-003","prediction":{"PQ-RSI-003/new_key":{"local_validity":true,"observation":{"outputs":{"algorithm_identity":{"algorithm_specific_verification":"UNSUPPORTED","artifact_algorithm":"SLH-DSA-SHA2-192s","label_matches_artifact":false,"reported_label":"ML-DSA"},"anchor_validation":{"reason":"anchor_evidence_is_supplied_policy_input_not_recomputed_here","status":"UNSUPPORTED"},"authenticated_transition_validation":{"reason":"offline_source_defers_signature_verification","status":"UNSUPPORTED"},"claim_admissible":true,"current_binding":{"name":"kya-l4-rotation-1","pq_pubkey":"8488157a2b55ba45f7dd6768db29bc9013936ea668a3001ca33cc817328c373c714d84d3872f1bb619bec02268ab34b5","reason":"resolved_at_anchor_time"},"historical_eligibility":false,"history_matches_pin":true,"policy":{"decision":"ADMIT","resolution_reason":"resolved_at_anchor_time","resolved":"kya-l4-rotation-1","resolved_pq_pubkey":"8488157a2b55ba45f7dd6768db29bc9013936ea668a3001ca33cc817328c373c714d84d3872f1bb619bec02268ab34b5","rule":"valid_pq_companion"},"requested_claim":"policy_eligibility","snapshot_matches":true,"transition_metadata":{"predecessor_present":true,"signature_fields_present":true}},"relation_id":"policy-cutoff-asof","relation_state":"conditional_policy_observed"}}}},{"fixture_id":"PQ-RSI-004","prediction":{"PQ-RSI-004/created_at_is_not_anchor":{"local_validity":true,"observation":{"outputs":{"algorithm_identity":{"algorithm_specific_verification":"UNSUPPORTED","artifact_algorithm":"SLH-DSA-SHA2-192s","label_matches_artifact":false,"reported_label":"ML-DSA"},"anchor_validation":{"reason":"anchor_evidence_is_supplied_policy_input_not_recomputed_here","status":"UNSUPPORTED"},"authenticated_transition_validation":{"reason":"offline_source_defers_signature_verification","status":"UNSUPPORTED"},"claim_admissible":false,"current_binding":{"name":"kya-l4-rotation-1","pq_pubkey":"8488157a2b55ba45f7dd6768db29bc9013936ea668a3001ca33cc817328c373c714d84d3872f1bb619bec02268ab34b5","reason":"resolved_at_anchor_time"},"historical_eligibility":false,"history_matches_pin":true,"policy":{"decision":"REJECT","resolution_reason":"resolved_at_anchor_time","resolved":"kya-l4-genesis","resolved_pq_pubkey":"638c79a2210c85e8cb349fc72a6583b7ff82e003ff02117f8f7f9d8cc3fb92a33e7496d987beb05f22bf12ecf34bc7aa","rule":"post_cutoff_no_valid_companion"},"requested_claim":"policy_eligibility","snapshot_matches":true,"transition_metadata":{"predecessor_present":true,"signature_fields_present":true}},"relation_id":"policy-cutoff-asof","relation_state":"conditional_policy_observed"}},"PQ-RSI-004/historical_anchor":{"local_validity":true,"observation":{"outputs":{"algorithm_identity":{"algorithm_specific_verification":"UNSUPPORTED","artifact_algorithm":"SLH-DSA-SHA2-192s","label_matches_artifact":false,"reported_label":"ML-DSA"},"anchor_validation":{"reason":"anchor_evidence_is_supplied_policy_input_not_recomputed_here","status":"UNSUPPORTED"},"authenticated_transition_validation":{"reason":"offline_source_defers_signature_verification","status":"UNSUPPORTED"},"claim_admissible":true,"current_binding":{"name":"kya-l4-rotation-1","pq_pubkey":"8488157a2b55ba45f7dd6768db29bc9013936ea668a3001ca33cc817328c373c714d84d3872f1bb619bec02268ab34b5","reason":"resolved_at_anchor_time"},"historical_eligibility":true,"history_matches_pin":true,"policy":{"decision":"ADMIT","resolution_reason":"resolved_at_anchor_time","resolved":"kya-l4-genesis","resolved_pq_pubkey":"638c79a2210c85e8cb349fc72a6583b7ff82e003ff02117f8f7f9d8cc3fb92a33e7496d987beb05f22bf12ecf34bc7aa","rule":"anchored_before_cutoff"},"requested_claim":"policy_eligibility","snapshot_matches":true,"transition_metadata":{"predecessor_present":true,"signature_fields_present":true}},"relation_id":"policy-cutoff-asof","relation_state":"conditional_policy_observed"}}}},{"fixture_id":"PQ-RSI-005","prediction":{"PQ-RSI-005/stale_snapshot":{"local_validity":true,"observation":{"outputs":{"algorithm_identity":{"algorithm_specific_verification":"UNSUPPORTED","artifact_algorithm":"SLH-DSA-SHA2-192s","label_matches_artifact":false,"reported_label":"ML-DSA"},"anchor_validation":{"reason":"anchor_evidence_is_supplied_policy_input_not_recomputed_here","status":"UNSUPPORTED"},"authenticated_transition_validation":{"reason":"offline_source_defers_signature_verification","status":"UNSUPPORTED"},"claim_admissible":false,"current_binding":{"name":"kya-l4-rotation-1","pq_pubkey":"8488157a2b55ba45f7dd6768db29bc9013936ea668a3001ca33cc817328c373c714d84d3872f1bb619bec02268ab34b5","reason":"resolved_at_anchor_time"},"historical_eligibility":false,"history_matches_pin":true,"policy":{"decision":"ADMIT","resolution_reason":"resolved_at_anchor_time","resolved":"kya-l4-rotation-1","resolved_pq_pubkey":"8488157a2b55ba45f7dd6768db29bc9013936ea668a3001ca33cc817328c373c714d84d3872f1bb619bec02268ab34b5","rule":"valid_pq_companion"},"requested_claim":"policy_eligibility","snapshot_matches":false,"transition_metadata":{"predecessor_present":true,"signature_fields_present":true}},"relation_id":"policy-cutoff-asof","relation_state":"conditional_policy_observed"}}}},{"fixture_id":"PQ-RSI-007","prediction":{"PQ-RSI-007/metadata_not_authentication":{"local_validity":true,"observation":{"outputs":{"algorithm_identity":{"algorithm_specific_verification":"UNSUPPORTED","artifact_algorithm":"SLH-DSA-SHA2-192s","label_matches_artifact":false,"reported_label":"ML-DSA"},"anchor_validation":{"reason":"anchor_evidence_is_supplied_policy_input_not_recomputed_here","status":"UNSUPPORTED"},"authenticated_transition_validation":{"reason":"offline_source_defers_signature_verification","status":"UNSUPPORTED"},"claim_admissible":false,"current_binding":{"name":"kya-l4-rotation-1","pq_pubkey":"8488157a2b55ba45f7dd6768db29bc9013936ea668a3001ca33cc817328c373c714d84d3872f1bb619bec02268ab34b5","reason":"resolved_at_anchor_time"},"historical_eligibility":false,"history_matches_pin":true,"policy":{"decision":"ADMIT","resolution_reason":"resolved_at_anchor_time","resolved":"kya-l4-rotation-1","resolved_pq_pubkey":"8488157a2b55ba45f7dd6768db29bc9013936ea668a3001ca33cc817328c373c714d84d3872f1bb619bec02268ab34b5","rule":"valid_pq_companion"},"requested_claim":"authenticated_transition","snapshot_matches":true,"transition_metadata":{"predecessor_present":true,"signature_fields_present":true}},"relation_id":"policy-cutoff-asof","relation_state":"conditional_policy_observed"}}}}],"fixture_set_digest":"ed8bc1c2a0a17ff306293d44894189f47db109207ace56b2149381c584836da7","profile_id":"pq.policy-asof.v0","profile_version":"0","schema":"rsi-expectations.v0"}
