{"expectations":[{"fixture_id":"VL-RSI-001","prediction":{"VL-RSI-001/control":{"local_validity":true,"observation":{"outputs":{"accountExists":true,"boundToHeader":true,"claimMatchesProof":true,"downstreamAuthority":"UNSUPPORTED","headerAuthority":"UNSUPPORTED","headerTrust":"RPC-TRUSTED","overall":"state-proven / header RPC-TRUSTED","provenBalanceWei":"2057762111636750387534361","stateTrust":"RE-DERIVED","verified":true},"relation_id":"account-proof-root-balance","relation_state":"account_observed"}}}},{"fixture_id":"VL-RSI-002","prediction":{"VL-RSI-002/wrong_root":{"local_validity":true,"observation":{"outputs":{"accountExists":true,"boundToHeader":false,"claimMatchesProof":true,"downstreamAuthority":"UNSUPPORTED","headerAuthority":"UNSUPPORTED","headerTrust":"RPC-TRUSTED","overall":"rejected","provenBalanceWei":"2057762111636750387534361","stateTrust":"UNVERIFIED","verified":false},"relation_id":"account-proof-root-balance","relation_state":"account_observed"}}}},{"fixture_id":"VL-RSI-005","prediction":{"VL-RSI-005/wrong_account":{"local_validity":true,"observation":{"outputs":{"accountExists":null,"boundToHeader":null,"claimMatchesProof":null,"downstreamAuthority":"UNSUPPORTED","headerAuthority":"UNSUPPORTED","headerTrust":"RPC-TRUSTED","overall":"rejected","provenBalanceWei":null,"stateTrust":"MPT-REJECTED","verified":false},"relation_id":"account-proof-root-balance","relation_state":"account_observed"}}}},{"fixture_id":"VL-RSI-006","prediction":{"VL-RSI-006/hex_case_mirror":{"local_validity":true,"observation":{"outputs":{"accountExists":true,"boundToHeader":true,"claimMatchesProof":true,"downstreamAuthority":"UNSUPPORTED","headerAuthority":"UNSUPPORTED","headerTrust":"RPC-TRUSTED","overall":"state-proven / header RPC-TRUSTED","provenBalanceWei":"2057762111636750387534361","stateTrust":"RE-DERIVED","verified":true},"relation_id":"account-proof-root-balance","relation_state":"account_observed"}}}},{"fixture_id":"VL-RSI-007","prediction":{"VL-RSI-007/rpc_header_only":{"local_validity":true,"observation":{"outputs":{"accountExists":true,"boundToHeader":true,"claimMatchesProof":true,"downstreamAuthority":"UNSUPPORTED","headerAuthority":"UNSUPPORTED","headerTrust":"RPC-TRUSTED","overall":"state-proven / header RPC-TRUSTED","provenBalanceWei":"2057762111636750387534361","stateTrust":"RE-DERIVED","verified":true},"relation_id":"account-proof-root-balance","relation_state":"account_observed"}}}},{"fixture_id":"VL-RSI-008","prediction":{"VL-RSI-008/wrong_balance":{"local_validity":true,"observation":{"outputs":{"accountExists":true,"boundToHeader":true,"claimMatchesProof":false,"downstreamAuthority":"UNSUPPORTED","headerAuthority":"UNSUPPORTED","headerTrust":"RPC-TRUSTED","overall":"rejected","provenBalanceWei":"2057762111636750387534361","stateTrust":"UNVERIFIED","verified":false},"relation_id":"account-proof-root-balance","relation_state":"account_observed"}}}}],"fixture_set_digest":"902cda6f52fedbaedef062a159e56d8f2fbf017d2242243b56724f92de495a9e","profile_id":"verify-layer.proof-context.v0","profile_version":"0","schema":"rsi-expectations.v0"}
