{"expectations":[{"fixture_id":"CE-RSI-001","prediction":{"CE-RSI-001/control":{"local_validity":true,"observation":{"outputs":{"error":null,"escrow_status":"Released","execution_occurrence":"LOCAL_EVM","provider_delta":"1000000000000000000","release_eligible":true,"released_event":{"amount":"1000000000000000000","commitment_hash":"0xdfc4e0a9ce3a933bb0faffc6141ada1384d7951d8d039f0fadb32b7aea93ad05","job_id":"0xfcf3e85579d8e8b2a552598f7ee2dec5ae2f5680e30ef46d6b7b1f32fa40f9ef","provider":"0x00000000000000000000000000000000000010b0","result_hash":"0x39ec14ae2c3f0f117064439fafc334226d904db5679f0ae2e8d731c01843cb9a"}},"relation_id":"job-bound-release","relation_state":"release_observed"}},"CE-RSI-001/wrong_attestor":{"local_validity":true,"observation":{"outputs":{"error":"bad attestor sig","escrow_status":"Open","execution_occurrence":"UNSUPPORTED","provider_delta":"0","release_eligible":false,"released_event":null},"relation_id":"job-bound-release","relation_state":"release_observed"}}}},{"fixture_id":"CE-RSI-002","prediction":{"CE-RSI-002/wrong_job":{"local_validity":true,"observation":{"outputs":{"error":"bad attestor sig","escrow_status":"Open","execution_occurrence":"UNSUPPORTED","provider_delta":"0","release_eligible":false,"released_event":null},"relation_id":"job-bound-release","relation_state":"release_observed"}},"CE-RSI-002/wrong_result":{"local_validity":true,"observation":{"outputs":{"error":"bad attestor sig","escrow_status":"Open","execution_occurrence":"UNSUPPORTED","provider_delta":"0","release_eligible":false,"released_event":null},"relation_id":"job-bound-release","relation_state":"release_observed"}}}},{"fixture_id":"CE-RSI-006","prediction":{"CE-RSI-006/replayed_release":{"local_validity":true,"observation":{"outputs":{"error":"not open","escrow_status":"Released","execution_occurrence":"UNSUPPORTED","provider_delta":"0","release_eligible":false,"released_event":null},"relation_id":"job-bound-release","relation_state":"release_observed"}}}},{"fixture_id":"CE-RSI-007","prediction":{"CE-RSI-007/relayer_mirror":{"local_validity":true,"observation":{"outputs":{"error":null,"escrow_status":"Released","execution_occurrence":"LOCAL_EVM","provider_delta":"1000000000000000000","release_eligible":true,"released_event":{"amount":"1000000000000000000","commitment_hash":"0xdfc4e0a9ce3a933bb0faffc6141ada1384d7951d8d039f0fadb32b7aea93ad05","job_id":"0xfcf3e85579d8e8b2a552598f7ee2dec5ae2f5680e30ef46d6b7b1f32fa40f9ef","provider":"0x00000000000000000000000000000000000010b0","result_hash":"0x39ec14ae2c3f0f117064439fafc334226d904db5679f0ae2e8d731c01843cb9a"}},"relation_id":"job-bound-release","relation_state":"release_observed"}}}},{"fixture_id":"CE-RSI-008","prediction":{"CE-RSI-008/preflight_only":{"local_validity":true,"observation":{"outputs":{"error":null,"escrow_status":"Open","execution_occurrence":"UNSUPPORTED","provider_delta":"0","release_eligible":true,"released_event":null},"relation_id":"job-bound-release","relation_state":"release_observed"}}}}],"fixture_set_digest":"bae627605c4c7ed84ce3ea543e4b202fe35fb43d5eeb975c674d0a05c461785a","profile_id":"consult-escrow.release-binding.v0","profile_version":"0","schema":"rsi-expectations.v0"}
