{"expectations":[{"fixture_id":"TSEI-RSI-001","prediction":{"TSEI-RSI-001/binding_control":{"local_validity":true,"observation":{"outputs":{"artifact_binding_state":"bound","artifact_covered":true,"artifact_serialized_sha256":"81103aa69250ea56e887eaab3cd9bf363d341563f05d0676be389c3e40a72871","authority_validation":{"reason":"required authority recomputation operands unavailable in canonical public receipt package","status":"UNSUPPORTED"},"claim_admissible":true,"local_structure_valid":true,"mechanism_active":true,"producer_adopted":true,"record_introduced":true,"record_verdict":"valid","requested_claim":"serializer_binding","serializer_binding":true},"relation_id":"serializer-adoption-boundary","relation_state":"serializer_adoption_observed"}}}},{"fixture_id":"TSEI-RSI-002","prediction":{"TSEI-RSI-002/wrong_serializer":{"local_validity":true,"observation":{"outputs":{"artifact_binding_state":"binding_not_established","artifact_covered":false,"artifact_serialized_sha256":"81103aa69250ea56e887eaab3cd9bf363d341563f05d0676be389c3e40a72871","authority_validation":{"reason":"required authority recomputation operands unavailable in canonical public receipt package","status":"UNSUPPORTED"},"claim_admissible":false,"local_structure_valid":true,"mechanism_active":true,"producer_adopted":true,"record_introduced":true,"record_verdict":"valid","requested_claim":"serializer_binding","serializer_binding":false},"relation_id":"serializer-adoption-boundary","relation_state":"serializer_adoption_observed"}}}},{"fixture_id":"TSEI-RSI-003","prediction":{"TSEI-RSI-003/mechanism_not_adoption":{"local_validity":true,"observation":{"outputs":{"artifact_binding_state":"historically_unversioned","artifact_covered":false,"artifact_serialized_sha256":"0ef9ee8f579b091d7287f05955661b04c386726e1b38c2009fa46005a09e0107","authority_validation":{"reason":"required authority recomputation operands unavailable in canonical public receipt package","status":"UNSUPPORTED"},"claim_admissible":false,"local_structure_valid":true,"mechanism_active":true,"producer_adopted":false,"record_introduced":false,"record_verdict":"valid","requested_claim":"serializer_binding","serializer_binding":true},"relation_id":"serializer-adoption-boundary","relation_state":"serializer_adoption_observed"}}}},{"fixture_id":"TSEI-RSI-004","prediction":{"TSEI-RSI-004/adopted_before_record":{"local_validity":true,"observation":{"outputs":{"artifact_binding_state":"binding_not_established","artifact_covered":false,"artifact_serialized_sha256":"81103aa69250ea56e887eaab3cd9bf363d341563f05d0676be389c3e40a72871","authority_validation":{"reason":"required authority recomputation operands unavailable in canonical public receipt package","status":"UNSUPPORTED"},"claim_admissible":false,"local_structure_valid":true,"mechanism_active":true,"producer_adopted":true,"record_introduced":false,"record_verdict":"valid","requested_claim":"serializer_binding","serializer_binding":true},"relation_id":"serializer-adoption-boundary","relation_state":"serializer_adoption_observed"}}}},{"fixture_id":"TSEI-RSI-005","prediction":{"TSEI-RSI-005/record_introduced":{"local_validity":true,"observation":{"outputs":{"artifact_binding_state":"bound","artifact_covered":true,"artifact_serialized_sha256":"81103aa69250ea56e887eaab3cd9bf363d341563f05d0676be389c3e40a72871","authority_validation":{"reason":"required authority recomputation operands unavailable in canonical public receipt package","status":"UNSUPPORTED"},"claim_admissible":true,"local_structure_valid":true,"mechanism_active":true,"producer_adopted":true,"record_introduced":true,"record_verdict":"valid","requested_claim":"serializer_binding","serializer_binding":true},"relation_id":"serializer-adoption-boundary","relation_state":"serializer_adoption_observed"}}}},{"fixture_id":"TSEI-RSI-006","prediction":{"TSEI-RSI-006/historical_not_rebound":{"local_validity":true,"observation":{"outputs":{"artifact_binding_state":"historically_unversioned","artifact_covered":false,"artifact_serialized_sha256":"0ef9ee8f579b091d7287f05955661b04c386726e1b38c2009fa46005a09e0107","authority_validation":{"reason":"required authority recomputation operands unavailable in canonical public receipt package","status":"UNSUPPORTED"},"claim_admissible":false,"local_structure_valid":true,"mechanism_active":true,"producer_adopted":true,"record_introduced":true,"record_verdict":"valid","requested_claim":"serializer_binding","serializer_binding":true},"relation_id":"serializer-adoption-boundary","relation_state":"serializer_adoption_observed"}}}},{"fixture_id":"TSEI-RSI-007","prediction":{"TSEI-RSI-007/reported_not_recomputed":{"local_validity":true,"observation":{"outputs":{"artifact_binding_state":"bound","artifact_covered":true,"artifact_serialized_sha256":"81103aa69250ea56e887eaab3cd9bf363d341563f05d0676be389c3e40a72871","authority_validation":{"reason":"required authority recomputation operands unavailable in canonical public receipt package","status":"UNSUPPORTED"},"claim_admissible":false,"local_structure_valid":true,"mechanism_active":true,"producer_adopted":true,"record_introduced":true,"record_verdict":"valid","requested_claim":"provenance_authority","serializer_binding":true},"relation_id":"serializer-adoption-boundary","relation_state":"serializer_adoption_observed"}}}}],"fixture_set_digest":"04f445d380b0df490195be4dfb5589fc371c816361ba8d8c94c6d011a7f0abea","profile_id":"tsei.serializer-adoption.v0","profile_version":"0","schema":"rsi-expectations.v0"}
