{"expectations":[{"fixture_id":"SABI-RSI-001","prediction":{"SABI-RSI-001/control":{"local_validity":true,"observation":{"outputs":{"claim_truth":"UNSUPPORTED","edge_compatible":true,"execution_occurrence":"UNSUPPORTED","explicit_boundary_hit":false},"relation_id":"claim-authority-scope-time-binding","relation_state":"edge_observed"}}}},{"fixture_id":"SABI-RSI-002","prediction":{"SABI-RSI-002/claim_substitution":{"local_validity":true,"observation":{"outputs":{"claim_truth":"UNSUPPORTED","edge_compatible":false,"execution_occurrence":"UNSUPPORTED","explicit_boundary_hit":false},"relation_id":"claim-authority-scope-time-binding","relation_state":"edge_observed"}}}},{"fixture_id":"SABI-RSI-003","prediction":{"SABI-RSI-003/scope_substitution":{"local_validity":true,"observation":{"outputs":{"claim_truth":"UNSUPPORTED","edge_compatible":false,"execution_occurrence":"UNSUPPORTED","explicit_boundary_hit":false},"relation_id":"claim-authority-scope-time-binding","relation_state":"edge_observed"}}}},{"fixture_id":"SABI-RSI-004","prediction":{"SABI-RSI-004/authority_substitution":{"local_validity":true,"observation":{"outputs":{"claim_truth":"UNSUPPORTED","edge_compatible":false,"execution_occurrence":"UNSUPPORTED","explicit_boundary_hit":false},"relation_id":"claim-authority-scope-time-binding","relation_state":"edge_observed"}}}},{"fixture_id":"SABI-RSI-005","prediction":{"SABI-RSI-005/time_substitution":{"local_validity":true,"observation":{"outputs":{"claim_truth":"UNSUPPORTED","edge_compatible":false,"execution_occurrence":"UNSUPPORTED","explicit_boundary_hit":false},"relation_id":"claim-authority-scope-time-binding","relation_state":"edge_observed"}}}},{"fixture_id":"SABI-RSI-006","prediction":{"SABI-RSI-006/temporal_kind":{"local_validity":true,"observation":{"outputs":{"claim_truth":"UNSUPPORTED","edge_compatible":false,"execution_occurrence":"UNSUPPORTED","explicit_boundary_hit":false},"relation_id":"claim-authority-scope-time-binding","relation_state":"edge_observed"}}}},{"fixture_id":"SABI-RSI-007","prediction":{"SABI-RSI-007/local_recomputation":{"local_validity":true,"observation":{"outputs":{"claim_truth":"UNSUPPORTED","edge_compatible":true,"execution_occurrence":"UNSUPPORTED","explicit_boundary_hit":false},"relation_id":"claim-authority-scope-time-binding","relation_state":"edge_observed"}}}},{"fixture_id":"SABI-RSI-008","prediction":{"SABI-RSI-008/recomputation_wrong_claim":{"local_validity":true,"observation":{"outputs":{"claim_truth":"UNSUPPORTED","edge_compatible":false,"execution_occurrence":"UNSUPPORTED","explicit_boundary_hit":false},"relation_id":"claim-authority-scope-time-binding","relation_state":"edge_observed"}}}},{"fixture_id":"SABI-RSI-009","prediction":{"SABI-RSI-009/recomputation_wrong_scope":{"local_validity":true,"observation":{"outputs":{"claim_truth":"UNSUPPORTED","edge_compatible":false,"execution_occurrence":"UNSUPPORTED","explicit_boundary_hit":false},"relation_id":"claim-authority-scope-time-binding","relation_state":"edge_observed"}}}},{"fixture_id":"SABI-RSI-010","prediction":{"SABI-RSI-010/recomputation_wrong_time":{"local_validity":true,"observation":{"outputs":{"claim_truth":"UNSUPPORTED","edge_compatible":false,"execution_occurrence":"UNSUPPORTED","explicit_boundary_hit":false},"relation_id":"claim-authority-scope-time-binding","relation_state":"edge_observed"}}}},{"fixture_id":"SABI-RSI-011","prediction":{"SABI-RSI-011/reverse_coercion":{"local_validity":true,"observation":{"outputs":{"claim_truth":"UNSUPPORTED","edge_compatible":false,"execution_occurrence":"UNSUPPORTED","explicit_boundary_hit":false},"relation_id":"claim-authority-scope-time-binding","relation_state":"edge_observed"}}}},{"fixture_id":"SABI-RSI-012","prediction":{"SABI-RSI-012/cross_claim_mixing":{"local_validity":true,"observation":{"outputs":{"claim_truth":"UNSUPPORTED","edge_compatible":false,"execution_occurrence":"UNSUPPORTED","explicit_boundary_hit":false},"relation_id":"claim-authority-scope-time-binding","relation_state":"edge_observed"}}}},{"fixture_id":"SABI-RSI-013","prediction":{"SABI-RSI-013/component_mirror":{"local_validity":true,"observation":{"outputs":{"claim_truth":"UNSUPPORTED","edge_compatible":true,"execution_occurrence":"UNSUPPORTED","explicit_boundary_hit":false},"relation_id":"claim-authority-scope-time-binding","relation_state":"edge_observed"}}}},{"fixture_id":"SABI-RSI-014","prediction":{"SABI-RSI-014/explicit_negative":{"local_validity":true,"observation":{"outputs":{"claim_truth":"UNSUPPORTED","edge_compatible":false,"execution_occurrence":"UNSUPPORTED","explicit_boundary_hit":true},"relation_id":"claim-authority-scope-time-binding","relation_state":"edge_observed"}}}},{"fixture_id":"SABI-RSI-015","prediction":{"SABI-RSI-015/reason_mirror":{"local_validity":true,"observation":{"outputs":{"claim_truth":"UNSUPPORTED","edge_compatible":false,"execution_occurrence":"UNSUPPORTED","explicit_boundary_hit":true},"relation_id":"claim-authority-scope-time-binding","relation_state":"edge_observed"}}}},{"fixture_id":"SABI-RSI-016","prediction":{"SABI-RSI-016/positive_precedence":{"local_validity":true,"observation":{"outputs":{"claim_truth":"UNSUPPORTED","edge_compatible":true,"execution_occurrence":"UNSUPPORTED","explicit_boundary_hit":false},"relation_id":"claim-authority-scope-time-binding","relation_state":"edge_observed"}}}}],"fixture_set_digest":"b6bfe7ad681754cf108ba2f12189ce92b489d763fd366a1d2c68a9dc52c2afe1","profile_id":"semantic-abi.claim-edge.v0","profile_version":"0","schema":"rsi-expectations.v0"}
