{"expectations":[{"fixture_id":"CR-RSI-001","prediction":{"CR-RSI-001/control":{"local_validity":true,"observation":{"outputs":{"baseline_outcome":"accepted_snapshot","candidate_outcome":"accepted_snapshot","canonical_baseline":"{\"challenge_id\":\"observed_not_validated\",\"expected_conformance_observation\":\"preserve semantic non-elevation\",\"profile_id\":\"counterfactual-review-v0\"}","canonical_candidate":"{\"challenge_id\":\"observed_not_validated\",\"expected_conformance_observation\":\"preserve semantic non-elevation\",\"profile_id\":\"counterfactual-review-v0\"}","semantic_identity_preserved":true},"relation_id":"counterfactual_audit_boundary.semantic_snapshot_equivalence.v0","relation_state":"semantic_snapshots_match"}},"CR-RSI-001/relation_substitution":{"local_validity":true,"observation":{"outputs":{"baseline_outcome":"accepted_snapshot","candidate_outcome":"accepted_snapshot","canonical_baseline":"{\"challenge_id\":\"observed_not_validated\",\"expected_conformance_observation\":\"preserve semantic non-elevation\",\"profile_id\":\"counterfactual-review-v0\"}","canonical_candidate":"{\"challenge_id\":\"observed_not_validated\",\"expected_conformance_observation\":\"incorrectly promote observation\",\"profile_id\":\"counterfactual-review-v0\"}","semantic_identity_preserved":false},"relation_id":"counterfactual_audit_boundary.semantic_snapshot_equivalence.v0","relation_state":"canonical_snapshots_differ"}}}},{"fixture_id":"CR-RSI-002","prediction":{"CR-RSI-002/audit_timestamp_changed":{"local_validity":true,"observation":{"outputs":{"baseline_outcome":"accepted_snapshot","candidate_outcome":"accepted_snapshot","canonical_baseline":"{\"challenge_id\":\"observed_not_validated\",\"expected_conformance_observation\":\"preserve semantic non-elevation\",\"profile_id\":\"counterfactual-review-v0\"}","canonical_candidate":"{\"challenge_id\":\"observed_not_validated\",\"expected_conformance_observation\":\"preserve semantic non-elevation\",\"profile_id\":\"counterfactual-review-v0\"}","semantic_identity_preserved":true},"relation_id":"counterfactual_audit_boundary.semantic_snapshot_equivalence.v0","relation_state":"semantic_snapshots_match"}},"CR-RSI-002/audit_timestamp_removed":{"local_validity":true,"observation":{"outputs":{"baseline_outcome":"accepted_snapshot","candidate_outcome":"accepted_snapshot","canonical_baseline":"{\"challenge_id\":\"observed_not_validated\",\"expected_conformance_observation\":\"preserve semantic non-elevation\",\"profile_id\":\"counterfactual-review-v0\"}","canonical_candidate":"{\"challenge_id\":\"observed_not_validated\",\"expected_conformance_observation\":\"preserve semantic non-elevation\",\"profile_id\":\"counterfactual-review-v0\"}","semantic_identity_preserved":true},"relation_id":"counterfactual_audit_boundary.semantic_snapshot_equivalence.v0","relation_state":"semantic_snapshots_match"}}}}],"fixture_set_digest":"e44ae7b06472331cb5d68d2e16abfaee10400f51fb3dca4ac7fba6f5b0ab18d8","profile_id":"crystal-receipt.v0","profile_version":"0","schema":"rsi-expectations.v0"}
